doc_id,title,text
Es importante indicar que las anteriores precisiones parten de la base que ya se eligió el procedimiento de retención, no suponen un cambio en el procedimiento de retención durante el transcurso del año, pues una vez elegido es obligatoria su aplicación. En consecuencia, los cambios de procedimiento de retención se aplican a partir del año siguiente.

**TÍTULO 3**

**DISPOSICIONES VARIAS**

**3.1. DESCRIPTOR:** **Modificado. Concepto 915/2018**

**Presentación de la declaración del impuesto sobre la renta**

**¿Están obligados a presentar la declaración del impuesto sobre la renta los no residentes cuando sus ingresos no superen las 1.400 UVT?**

De conformidad con el artículo 9° del E.T., las personas naturales, nacionales o extranjeras, residentes en el país y las sucesiones ilíquidas de causantes con residencia en el país en el momento de su muerte, están sujetas al impuesto sobre la renta y complementarios en lo concerniente a sus rentas y ganancias ocasionales, tanto de fuente nacional como de fuente extranjera, y a su patrimonio poseído dentro y fuera del país.

Por el contrario, las personas naturales, nacionales o extranjeras, que no tengan residencia en el país y las sucesiones ilíquidas de causantes sin residencia en el país en el momento de su muerte, solo están sujetas al impuesto sobre la renta y complementarios respecto a sus rentas y ganancias ocasionales de fuente nacional y respecto de su patrimonio poseído en el país.

En ese orden de ideas, el artículo 10 del E.T., establece las condiciones para determinar si una persona natural es residente en Colombia o no para efectos tributarios. Una vez la persona natural verifique que sí cumple con las condiciones del artículo 10 del E.T., será considerado residente fiscal colombiano a efectos tributarios y, por ende, deberá tributar por su renta de fuente nacional y por su renta de fuente extranjera; ahora bien, si la persona natural verifica que no cumple con las condiciones del artículo 10 del E.T., no será considerando residente fiscal colombiano a efectos tributarios y, por ende, únicamente deberá tributaria por su renta de fuente nacional si a ello hubiere lugar.

Ahora bien, para determinar si una persona natural está obligada a declarar, es preciso remitirnos al artículo 592 del E.T. el cual indico lo siguiente:

_“_** artículo 592_**** _. Quiénes no están obligados a declarar._**_No están obligados a presentar declaración de renta y complementarios:_

_1\. Los contribuyentes personas naturales y sucesiones ilíquidas que no sean responsables del impuesto a las ventas, que en el respectivo año o período gravable hayan obtenido ingresos brutos inferiores a 1.400 UVT y que el patrimonio bruto en el último día del año o período gravable no exceda de 4.500 UVT._

_2\. Las personas naturales o jurídicas, extranjeras, sin residencia o domicilio en el país, cuando la totalidad de sus ingresos hubieren estado sometidos a la retención en la fuente de que tratan los artículos 407 a 411, inclusive, y dicha retención en la fuente, les hubiere sido practicada._

_3\. Los asalariados a quienes se les eliminó la declaración tributaria._

_4\. Los contribuyentes señalados en el artículo 414-4 (sic) de este Estatuto._

_5\. Las personas naturales que pertenezcan al monotributo.”_

Así las cosas, tanto un residente como un no residente fiscal colombiano a efectos tributarios, tendrán que verificar si cumplen o no con los requisitos previstos en el artículo transcrito, para así determinar si tienen la obligación de presentar declaración.

La diferencia estará en que el primero (residente) tendrá que declarar por su renta nacional, renta extranjera, patrimonio en Colombia y patrimonio fuera de Colombia; mientras que el segundo (no residente) tendrá que declarar por su renta nacional y por su patrimonio poseído en Colombia.

Para responder a la pregunta concreta, es necesario destacar el numeral 1 del artículo 592 del E.T., el cual dispone que una persona natural (sea residente o no) no tendrá que declarar cuando sus ingresos sean inferiores a 1.400 UVT y el patrimonio bruto no exceda de 4.500 UVT. De lo anterior, es claro que la norma exige que se cumplan ambas condiciones, es decir, los topes para ingresos como para patrimonio, a efectos de determinar si la persona natural está o no obligada a declarar. Lo anterior sin perjuicio de lo establecido en el numeral 2 del artículo 592 del E.T.

**3.2. DESCRIPTOR:** Presentación de la declaración del impuesto sobre la renta

**¿Cómo aplica lo contenido en los artículos****9°****y****10****del E.T. en el supuesto contenido en el artículo 14 de la Ley 1556 de 2012?**

El inciso primero del artículo 14 de la Ley 1556 de 2012, modificado por el artículo 373 de la Ley 1819 de 2016, establece:

**artículo 373._**_Modifíquese el artículo 14 de la Ley 1556 de 2012, el cual quedará así:**artículo 14. Participación artística y técnica extranjera.** Se entenderán **rentas de fuente extranjera los ingresos percibidos por los artistas, técnicos y personal de producción no residentes en el país, cuando no exista contrato ni se produzcan pagos en el país generados por su participación en obras audiovisuales de cualquier género, o en películas extranjeras que cuenten con la certificación expedida por la Dirección de Cinematografía del Ministerio de Cultura de que dicho proyecto se encuentra inscrito en el registro cinematográfico.** Lo anterior aplica **mientras dure la vinculación de dicho personal al proyecto audiovisual**._

_(…)”_(Negrilla fuera del texto).

La norma citada establece para estos ingresos un tratamiento de ingreso de fuente extranjera, tratándose de artistas, técnicos y personal de producción  __no residentes en el país__ , bajo los supuestos allí señalados y que debe entenderse en los términos del artículo 10 del E.T.

Adicionalmente, se requiere una interpretación armónica con lo señalado en el artículo 9° del E.T., que sujeta al impuesto sobre la renta y complementarios en lo concerniente a sus rentas y ganancias ocasionales, tanto de fuente nacional como de fuente extranjera, y a su patrimonio poseído dentro y fuera del país a las personas naturales nacionales o extranjeras, residentes en el país.

Así las cosas, resulta oportuno precisar que, si estos artistas, técnicos y personal de producción adquieren la calidad de residentes para efectos fiscales, en los términos del artículo 10 del E.T., deberán tributar en el país por sus rentas y ganancias ocasionales, tanto de fuente nacional como de fuente extranjera, para lo cual deberá incluir los ingresos de que trata el inciso primero del artículo 14 de la Ley 1556 de 2012.

**ACLARACIONES Y DEROGATORIAS**

El presente concepto unificado recoge la doctrina proferida por la Unidad Administrativa Especial Dirección de Impuestos y Aduanas Nacionales (DIAN) hasta la fecha y revoca todos los conceptos y oficios expedidos relacionados con los temas aquí analizados, en especial los siguientes: El Oficio 000358 del 15 de marzo de 2018, 100208221-10628 del 23 de mayo de 2018.

Aclara la respuesta al primer punto del Oficio 022426 del 18 de agosto de 2017, la tesis jurídica del Oficio 003706 del 15 de febrero de 2018, la conclusión final expuesta en el Oficio 007480 del 23 de marzo de 2018, el Oficio 008649 del 12 de abril de 2017.

**La Directora de Gestión Jurídica,**

_Liliana Andrea Forero Gómez._

**Publicado en D.O. 50.667 del 27 de julio de 2018.**"

"Dirección de Impuestos y Aduanas Nacionales, Concepto nro. 192 de 01-03-2024","Dirección de Impuestos y Aduanas Nacionales, Concepto nro. 192 de 01-03-2024","**PROBLEMA JURÍDICO**

En el contexto de precios de transferencia ¿el método de «Precio comparable no controlado» continuará siendo el más apropiado para determinar el precio de plena competencia en operaciones con commodities, cuando no exista un precio de cotización como referencia o transacciones comparables realizadas entre partes independientes?

**TESIS JURÍDICA**

Sí. El método Precio Comparable no Controlado (en adelante PC) es el más apropiado para determinar el precio de plena competencia en operaciones con  _commodities_ , incluso en situaciones donde existan diferencias significativas entre las condiciones de la transacción y las transacciones comparables, o las condiciones utilizadas para determinar el precio de mercado, puesto que en este caso la ley permite realizar ajustes suficientemente fiables y razonables para eliminar tales diferencias y garantizar un apropiado análisis de comparabilidad de la operación, a fin de aplicar efectivamente el método PC. Sólo en casos excepcionales, la ley habilita el uso de otro método, siempre y cuando se argumenten y demuestren los motivos que justifican la elección de un método diferente al PC en los términos que establece el inciso 7 del literal b) del numeral 1 del  artículo 260-3_ del Estatuto Tributario.

**FUNDAMENTACIÓN**

El literal b) del numeral 1º del  artículo 260-3_ del Estatuto Tributario establece que el método «Precio Comparable No Controlado» (PC) es el más apropiado para determinar el precio de plena competencia3 en operaciones que involucran «commodities»4. Además, el inciso 3º de esta normativa indica que el principio de plena competencia para las transacciones con commodities puede establecerse a partir de dos referencias: (i) transacciones comparables realizadas entre partes independientes (comparable interno)5, o (ii) precios de cotización (comparable externo).

Independientemente de la referencia seleccionada dentro del método de PC en operaciones con commodities, el inciso 4º del literal b) del numeral 1º del  artículo 260-3_ del Estatuto Tributario indica que, cuando existan diferencias entre las condiciones de la transacción de commodity analizada y las transacciones entre independientes, o las condiciones bajo las que se determina el precio de determinación del commodity, se deberá realizar los ajustes de comparabilidad razonables para asegurar que las características económicamente relevantes de las transacciones son comparables6.

Ahora bien, dos operaciones serán comparables, según el  artículo 260-4_ del Estatuto Tributario, cuando no existan diferencias significativas entre ellas, que puedan afectar materialmente las condiciones analizadas o cuando las diferencias que surjan puedan eliminarse realizando ajustes suficientemente fiables a fin de eliminar los efectos de dichas diferencias en la comparación. Según el párrafo 2.16 de las Directrices de la OCDE, la magnitud y la fiabilidad de dichos ajustes afectarán la confiabilidad relativa del análisis bajo el método PC.

Por lo tanto, una interpretación sistemática7 de las normas citadas permiten entender que el método PC es el método más apropiado8 para establecer el precio de plena competencia en operaciones con «commodities», y que aun en casos de diferencias entre las operaciones comparadas que puedan afectar sustancialmente el precio, el contribuyente está llamado a aplicarlo realizando los ajustes correspondientes que aseguren la comparabilidad material del precio a comparar.

Sin embargo, en situaciones excepcionales, el contribuyente puede optar por utilizar otro método de precios de transferencia, según el inciso final del literal b) del  artículo 260-3_ del Estatuto Tributario. La aplicación excepcional del otro método dependerá de la presentación adecuada de argumentos y pruebas que justifiquen de manera pertinente y razonable la elección de un método distinto al PC. Al respecto, el Consejo de Estado9 dijo:

«6.2- Observa la Sala que, tal como alega la demandante, el reglamento adopta un listado limitado de «casos excepcionales» que serían los únicos que habilitarían a emplear un método distinto al PC para fijar el precio de plena competencia en operaciones con commodities, siendo que la disposición reglamentada no circunscribe la excepcionalidad al señalamiento de supuestos específicos, sino a que se  _despliegue la adecuada carga argumentativa y demostrativa orientada a establecer los motivos pertinentes y razonables que forzaron a emplear un método distinto al PC_. Consecuentemente, con el reglamento se afectó la posibilidad prevista en la ley de implementar el método de valoración de operaciones apropiado, por circunstancias excepcionales.» (énfasis propio).

Por lo tanto, cada contribuyente deberá determinar sus circunstancias particulares para evaluar si se encuentra en los «casos excepcionales», de acuerdo con las razones económicas, financieras y técnicas pertinentes al que hace referencia el último inciso del literal b del numeral 1 del artículo 260-3 del Estatuto Tributario del Estatuto Tributario, para no utilizar el método PC cuando se trate de operaciones de commodities.

En consecuencia, por regla general, el método PC es el más apropiado para determinar el precio de plena competencia en operaciones con  _commodities_ , incluso en situaciones donde existan diferencias significativas entre las condiciones de la transacción y las transacciones comparables, o las condiciones utilizadas para determinar el precio de mercado, puesto que en este caso la ley permite realizar ajustes razonables para garantizar la comparabilidad de la operación a fin de aplicar efectivamente el método PC."

"Dirección de Impuestos y Aduanas Nacionales, Concepto nro. 597 de 01-07-2024","Dirección de Impuestos y Aduanas Nacionales, Concepto nro. 597 de 01-07-2024","**Problema Jurídico**

Los contribuyentes que realizaron inversiones en Fuentes no Convencionales de Energía - FNCE en vigencia del texto original de la Ley 1715 de 2014 en concordancia con el artículo 2.2.3.8.2.3. del Decreto 1073 de 2015 ¿pueden tomarse la deducción establecida en el artículo 11 de la Ley 1715 de 2014 en el año en el que realizaron la inversión?

**Tesis Jurídica**

No. El valor máximo por deducir en un período no mayor de cinco (5) años, se cuenta a partir del año gravable siguiente a aquel en el que se efectúan las nuevas erogaciones en investigación, desarrollo e inversión en el ámbito de la producción y utilización de energía a partir de FNCE o gestión eficiente de la energía.

En consecuencia, si la inversión se realizó en el año gravable 2017, la deducción procederá a partir del año 2018 por un término no mayor a cinco (5) años.

**Fundamentación**

El artículo 11 de la Ley 1715 de 2014, antes de la modificación efectuada por el artículo 174 de la Ley 1955 de 2019, establecía la siguiente deducción especial a la generación de energías no convencionales:

artículo 11.  _Incentivos a la generación de energías no convencionales_. Como fomento a la investigación, desarrollo e inversión en el ámbito de la producción y utilización de energía a partir de FNCE, la gestión eficiente de la energía,  _los obligados a declarar renta que realicen directamente inversiones en este sentido, tendrán derecho a reducir anualmente de su renta,_**_por los 5 años siguientes al año gravable en que hayan realizado la inversión_** _, el cincuenta por ciento (50%) del valor total de la inversión realizada_.

El valor a deducir por este concepto, en ningún caso podrá ser superior al 50% de la renta líquida del contribuyente determinada antes de restar el valor de la inversión.

Para los efectos de la obtención del presente beneficio tributario, la inversión causante del mismo deberá obtener la certificación de beneficio ambiental por el Ministerio de Ambiente y ser debidamente certificada como tal por el Ministerio de Medio Ambiente y Desarrollo Sostenible, en concordancia con lo establecido en el artículo 158-2 del Estatuto Tributario del Estatuto Tributario. (…) (énfasis propio).

La norma transcrita arriba, fue reglamentada por el Decreto 2143 de 20153, el cual adicionó el Decreto 1073 de 2015 y su artículo 2.2.3.8.2.3. dispuso, respecto del alcance de la aplicación de la deducción, lo siguiente:

“artículo 2.2.3.8.2.3. Alcance de la aplicación de la deducción especial. En la aplicación del beneficio de que trata el artículo 11 de la Ley 1715 de 2014, se observarán las siguientes reglas:

**1.****_El valor máximo a deducir en un período no mayor a cinco (5) años, contados a partir del año gravable siguiente a aquel en el que se efectúan las nuevas erogaciones en investigación, desarrollo e inversión en el ámbito de la producción y utilización de energía a partir de FNCE o gestión eficiente de la energía_** _, será del cincuenta por ciento (50%) del valor total de la inversión realizada._

2\. El valor máximo a deducir por período gravable en ningún caso podrá ser superior al cincuenta por ciento (50%) de la renta líquida del contribuyente, antes de restar la deducción.

3\. En la determinación y límites de la presente deducción, se dará aplicación al artículo 177-1 del Estatuto Tributario del Estatuto Tributario.

4\. Para los efectos de la obtención del presente beneficio tributario, se deberá verificar que las personas naturales o jurídicas, efectivamente sean titulares de nuevas inversiones en nuevos proyectos de FNCE y gestión eficiente de la energía.

5\. Los contribuyentes declarantes del impuesto sobre la renta obligados a llevar contabilidad podrán, adicional a lo establecido en los numerales 1 y 2 de este artículo, en el año en que se efectúe la inversión, deducir por las nuevas inversiones en proyectos de FNCE o gestión eficiente de la energía, el valor por depreciación o amortización que corresponda de acuerdo con el régimen general de deducciones previsto en el Estatuto Tributario o aquel previsto en el artículo 14 de la Ley 1715 de 2014. (cfr. artículo derogado por el artículo 4 del Decreto 829 de 2020) (énfasis añadido).

Conforme a la normatividad citada, el valor máximo a deducir en un período no mayor de cinco (5) años, se cuenta a partir del año gravable siguiente a aquel en el que se efectúan las nuevas erogaciones en investigación, desarrollo e inversión en el ámbito de la producción y utilización de energía a partir de FNCE o gestión eficiente de la energía.

Por lo que, el límite anual para deducir dependerá de la renta líquida del contribuyente, antes de restar el valor de la inversión. Así las cosas, si en el primer año en el que proceda la deducción, el valor a deducir es inferior al 50% de la renta líquida del contribuyente, el citado artículo 11 de la Ley 1715 de 2014 le permite al contribuyente deducir la totalidad del 50% de la inversión el primer año.

En el escenario en el que el valor a deducir sea superior al 50% de la renta líquida (calculada antes de la deducción especial), en el primer año, el contribuyente sólo podrá deducir hasta el monto permitido por la Ley. El saldo de la deducción, el contribuyente lo podrá tomar en un período no mayor a los cinco (5) años, sin que en período alguno supere el 50% de la renta líquida calculada ates de la deducción especial.

Lo anterior siempre y cuando se cumpla con la totalidad de los requisitos consagrados en la Ley y el reglamento vigentes para el año gravable en el que se realizó la inversión."

"Dirección de Impuestos y Aduanas Nacionales, Concepto nro. 9748 de 01-04-2019","Dirección de Impuestos y Aduanas Nacionales, Concepto nro. 9748 de 01-04-2019","100208221 – 000981
**Ref:** Radicado 100007479 del 04/02/2019
De conformidad con el artículo 20 del Decreto número 4048 de 2008 este despacho está facultado para absolver las consultas escritas que se formulen sobre la interpretación y aplicación de las normas tributarias, aduaneras o de comercio exterior y control cambiario en lo de competencia de la Dirección de Impuestos y Aduanas Nacionales.

Previo a contestar la petición, es necesario advertir que, de acuerdo a las competencias funcionales de este despacho, los pronunciamientos emitidos en respuesta a las peticiones allegadas se resuelven con base en criterios legales de interpretación de normas jurídicas, consagrados en el código civil; respuestas que son una adecuación en abstracto de las normas vigentes a situaciones concretas.

Los que a su vez no tienen como fin solucionar problemáticas individuales, validar posturas jurídicas y menos aún asesorar a entidades públicas o privadas en el desarrollo de las actividades a su cargo.

Mediante el radicado de la referencia el peticionario respecto del concepto de asignaciones permanentes y lo contenido en el artículo 1.2.1.5.1.29. del Decreto 1625 de 2016, consulta cuál es la forma como se debe ejercer un proyecto social que desarrolla una entidad del sector cooperativo.

Sobre el particular se considera:

Con el fin de resolver la consulta de la referencia, lo primero que se debe precisar es que artículo 1.2.1.5.1.29. del Decreto 1625 de 2016 hace parte de la Sección 1 del Capítulo 5 del Título 1 de la Parte 2 del Libro 1, sección que tiene por objeto la reglamentación de las entidades sin ánimo de lucro del artículo 19 del Estatuto Tributario, siempre que desarrollen las actividades meritorias enumeradas en el artículo 359 del Estatuto Tributario, las cuales deben ser de interés general y que tenga acceso la comunidad, y que ni sus aportes sean reembolsados ni sus excedentes sean distribuidos bajo ninguna modalidad, cualquiera que sea la denominación que se utilice, ni directa ni indirectamente, ni durante su existencia, ni en el momento de su disolución y liquidación.

En efecto, esta norma reglamentaria proporciona una definición de asignación permanente, en consonancia con lo dispuesto en el artículo 360 del Estatuto Tributario y que se propone precisar uno de los términos para que el beneficio neto o excedente tenga el carácter de exento del impuesto sobre la renta cuando estas asignaciones se constituyen.

En contraste, si bien las entidades del sector cooperativo hacen parte del Régimen Tributario Especial del impuesto sobre la renta y complementarios, estas se encuentran reguladas por lo dispuesto en el artículo 19-4 del Estatuto Tributario, adicionado por el artículo 142 de la Ley 1819 de 2016, norma que sobre la determinación del beneficio neto o excedente en su inciso segundo establece:

**_artículo 19-4. Tributación sobre la renta de las cooperativas._**_Las cooperativas, sus asociaciones, uniones, ligas centrales, organismos de grado superior de carácter financiero, las asociaciones mutualistas, instituciones auxiliares del cooperativismo, confederaciones cooperativas, previstas en la legislación cooperativa, vigilados por alguna superintendencia u organismo de control; pertenecen al Régimen Tributario Especial y tributan sobre sus beneficios netos o excedentes a la tarifa única especial del veinte por ciento (20%). El impuesto será tomado en su totalidad del Fondo de Educación y Solidaridad de que trata el artículo 54 de la Ley 79 de 1988._

**_Las cooperativas realizarán el cálculo de este beneficio neto o excedente de acuerdo con la ley y la normativa cooperativa vigente._**_Las reservas legales a las cuales se encuentran obligadas estas entidades no podrán ser registradas como un gasto para la determinación del beneficio neto o excedente._

_(…)_

(Negrilla fuera del texto)

En desarrollo de esta norma, el artículo 1.2.1.5.2.7. del Decreto 1625 de 2016, sobre la determinación del beneficio neto o excedente para las entidades del sector cooperativo precisa:

**_artículo 1.2.1.5.2.7. Determinación del beneficio neto o excedente para los contribuyentes de que trata el artículo 19-4 del Estatuto Tributario._**_Los contribuyentes del Régimen Tributario Especial de que tratan los artículos 19-4 del Estatuto Tributario y 1.2.1.5.2.1. de este Decreto calcularán el beneficio neto o excedente**de conformidad con los marcos técnicos normativos contables que resulten aplicables a los contribuyentes de que trata la presente Sección.**_

**_Parágrafo 1. Para las Cooperativas de Trabajo Asociado constituye ingreso gravable por la prestación de servicios el valor que quedare una vez descontado el monto de las compensaciones ordinarias y extraordinarias pagadas efectivamente a los trabajadores asociados cooperados, de conformidad con el reglamento de compensaciones, sin perjuicio de la obligación de declarar la totalidad de los ingresos percibidos por otros conceptos. Lo anterior de conformidad con lo previsto en el artículo 102-3 del Estatuto Tributario._**

**_Parágrafo 2. Para la procedencia de los egresos realizados en el respectivo período gravable que tengan relación de causalidad con los ingresos o con el objeto social, deberá tenerse en cuenta los requisitos señalados en los artículos 87-1, 107, 107-1, 108, 177-1, 177-2, 771-2 y 771-3 del Estatuto Tributario, sin perjuicio de acreditar la correspondiente retención en la fuente a título del impuesto sobre la renta y complementario, cuando hubiere lugar a ello._**

**_Parágrafo 3._**_La ejecución de beneficios netos o excedentes de años anteriores no constituye egreso o inversión del ejercicio._

(…)

(Negrilla fuera del texto)

Nótese como tanto lo dispuesto por la ley como el reglamento lo que hacen es reconocer respecto de estas entidades que su tributación es diferente a lo dispuesto para las otras entidades del Régimen Tributario Especial.

