doc_id,title,text

Respecto de la segunda opción, este despacho interpreta que la restricción consignada en la norma, esto es, que no se pueda imputar en más de una cédula una misma renta exenta o deducción, no significa que no sea posible imputar este valor de forma proporcional a cada cédula, pues lo que se prohíbe es reconocer el mismo  __en más de una cédula una misma renta exenta o deducción, razón por la cual se deberá hacer el correspondiente cálculo.__

**1.24. DESCRIPTOR:** Depuración de la renta

**Rentas exentas y deducciones**

**¿Las pérdidas fiscales están sometidas a los límites porcentuales o en UVT?**

Según el parágrafo transitorio del artículo 330 del E. T., modificado por el artículo 1° de la Ley 1819 del 2016: “Las pérdidas declaradas en períodos gravables anteriores a la vigencia de la presente ley únicamente podrán ser imputadas en contra de las cédulas de rentas no laborales y rentas de capital, en la misma proporción en que los ingresos correspondientes a estas cédulas participen dentro del total de los ingresos del período, teniendo en cuenta los límites y porcentajes de compensación establecidas en las normas vigentes”.

En ese sentido el artículo 1.2.1.20.6. del Decreto 1625 de 2016, estableció la metodología para la aplicación de esta disposición, que a la hora de su cálculo no hace parte de la determinación de la renta líquida, sino del cálculo de una proporción de los ingresos por renta no laboral y de capital la que se aplica a la pérdida fiscal no compensada y de esta manera se tiene el valor máximo a compensar para cada cédula en ese período gravable, valor que se restará de estas cédulas, sin que pueda exceder de la renta líquida de estas.

Por su parte, respecto de las pérdidas incurridas durante el año gravable, a partir del 1° de enero de 2017, dentro de una cédula solo podrán ser compensadas contra las rentas de la misma cédula, en los siguientes períodos gravables, teniendo en cuenta los límites y porcentajes de compensación establecidas en las normas vigentes.

En virtud de lo anteriormente señalado, se tiene que la compensación de pérdidas no se considera un beneficio fiscal, sino el resultado de la actividad del contribuyente en un correspondiente año gravable, por lo que no están sometidas a los límites porcentuales o en UVT.

**1.25. DESCRIPTOR:** Depuración de la renta

**Rentas exentas y deducciones**

**¿Para las personas naturales se entiende derogado el beneficio de renta exenta contenido en los numerales 3, 4 y 5 delartículo 207-2del E. T.?**

Tratándose de las personas naturales se ha interpretado que el tratamiento de renta exenta contenido en los numerales 3, 4 y 5 del artículo 207-2 del E. T., se entiende derogado tácitamente y constituyen ingreso gravado a partir del año gravable 2017 a la tarifa general que corresponda, de conformidad con el Título V del Libro I del Estatuto Tributario, Capítulo I  _“Determinación del impuesto sobre la renta de las personas naturales”_.

Lo anterior debido a que: (i) no están incluidas en el artículo 235-2 del E. T., norma que contiene las rentas exentas, y (ii) se estableció para las personas jurídicas que perciban estos ingresos una tarifa especial en el artículo 240 ibídem del 9%.

No obstante lo anteriormente planteado, llama la atención lo señalado en el inciso primero del artículo 235-2 del E. T., adicionado por el artículo 99 de la Ley 1819 de 2016:

**artículo 235-2_**** _. Rentas exentas a partir del año gravable 2018._**_A partir del 1° de enero de 2018,**sin perjuicio de las rentas exentas de las personas naturales** , las únicas excepciones legales de que trata el _ artículo 26_ _del Estatuto Tributario son las siguientes:_

_(…)_(Negrilla fuera del texto).

Nótese cómo la norma respecto de las personas naturales precisa que se tendrá que acudir al ordenamiento jurídico, para efectos de establecer cuáles son las rentas exentas que les resultan aplicables y, a título de ejemplo, se traen a colación las rentas laborales contenidas en el artículo 206 del Estatuto Tributariodel E. T.

También es importante resaltar del aparte citado que esta norma es aplicable a las personas jurídicas, pues al hacer una interpretación armónica de esta norma y el artículo 240 del E. T., que contiene la tarifa general del impuesto sobre la renta aplicable a las sociedades nacionales y sus asimiladas, los establecimientos permanentes de entidades del exterior y las personas jurídicas extranjeras o sin residencia obligadas a presentar la declaración anual del impuesto sobre la renta y complementarios y que en su parágrafo 1° establece una tarifa del 9% para aquellas las rentas contenidas en los numerales 3, 4 y 5 del artículo 207-2 del E. T., y la señalada en el artículo 1° de la Ley 939 de 2004, cuando se perciben por las personas jurídicas.

Para este despacho la misma conclusión no resulta aplicable tratándose de personas naturales, pues lo contenido en los numerales 3, 4 y 5 del artículo 207-2 del E. T., no fue materia de derogatoria expresa por parte del artículo 376 de la Ley 1819 de 2016. Esta situación hace necesario establecer su ámbito de aplicación, luego de las modificaciones que trajo la ley en comento.

En ese sentido, es oportuno recordar que los numerales 3, 4 y 5 del artículo 207-2 del E. T., antes de las modificaciones de la Ley 1819 de 2016 aplicaba de forma indistinta a las personas naturales y jurídicas. Lo que ocurrió con ocasión de la expedición de la ley es que este carácter de renta exenta cambió a ingreso gravado para las personas jurídicas el cual se grava al 9%, situación que implica la imposibilidad de aplicar los numerales en comento.

Sin embargo, para el caso de las personas naturales el texto de los numerales 3, 4 y 5 del artículo 207-2 del E. T., se mantiene incólume, en consideración a que se mantiene en el ordenamiento jurídico tributario y sobre los mismos no operó la derogatoria expresa del artículo 376 de la Ley 1819 de 2016, lo que de suyo permite concluir que está dentro de las rentas exentas aplicables a las personas naturales. Esta interpretación resulta válida en virtud del principio del efecto útil de las normas, que “enseña que, entre dos posibles sentidos de un precepto, uno de los cuales produce consecuencias jurídicas y el otro a nada conduce, debe preferirse el primero” (Cfr. Sent. T-001/1992, M. P. Hernández Galindo).

Igualmente, es importante indicar que en consideración al principio de confianza legítima la interpretación que se haga de estos numerales debe permitir el acceso al beneficio de la renta exenta de que tratan los numerales 3, 4 y 5 del artículo 207-2 del E. T., a las personas naturales, si estas dieron cumplimiento a los requisitos contenidos en la ley y el reglamento para tal fin.

Sobre el principio de confianza legítima la Corte Constitucional en Sentencia C-131 de 2004 ha precisado lo siguiente:

_“En tal sentido cabe señalar que como corolario del principio de la buena fe, la doctrina y jurisprudencia foráneas, desde mediados de la década de los sesentas, han venido elaborando una teoría sobre la confianza legítima, el cual ha conocido originales e importantes desarrollos a lo largo de diversos pronunciamientos de esta Corte._

_Así pues, en esencia, la confianza legítima consiste en que el ciudadano debe poder evolucionar en un medio jurídico estable y previsible, en cual pueda confiar. Para Müller, este vocablo significa, en términos muy generales, que ciertas expectativas, que son suscitadas por un sujeto de derecho en razón de un determinado comportamiento en relación con otro, o ante la comunidad jurídica en su conjunto, y que producen determinados efectos jurídicos; y si se trata de autoridades públicas, consiste en que la obligación para las mismas de preservar un comportamiento consecuente, no contradictorio frente a los particulares, surgido en un acto o acciones anteriores, incluso ilegales, salvo interés público imperioso contrario._

_Se trata, por tanto, que el particular debe ser protegido frente a cambios bruscos e inesperados efectuados por las autoridades públicas. En tal sentido, no se trata de amparar situaciones en las cuales el administrado sea titular de un derecho adquirido, ya que su posición jurídica es susceptible de ser modificada por la Administración, es decir, se trata de una mera expectativa en que una determinada situación de hecho o regulación jurídica no serán modificadas intempestivamente. (…)._

_De igual manera, la doctrina foránea considera que, en virtud del principio de la confianza legítima, la administración pública no le exigirá al ciudadano más de lo estrictamente necesario para la realización de los fines públicos que en cada caso persiga. (…)”._

Así las cosas, para el caso materia de análisis no es posible terminar con el disfrute de la renta exenta de que tratan estos numerales, si la persona natural dio cumplimiento a los requisitos contenidos en la ley y el reglamento.

En ese orden de ideas, la renta exenta a que se refieren los numerales 3, 4 y 5 del artículo 207-2 del E. T., debe aplicarse a las personas naturales que cumplan los requisitos allí contenidos y la reglamentación expedida para tal fin, eso sí considerando el límite general para las rentas exentas y deducciones introducido por la Ley 1819 de 2016, que para el caso de las rentas no laborales y la determinación de su renta líquida cedular señala:  _“Podrán restarse todas las rentas exentas y deducciones imputables a esta cédula, siempre que no excedan el diez (10%) del resultado del inciso anterior, que en todo caso no puede exceder mil (1.000) UVT”._

Lo anterior en consideración a que el referido límite general porcentual y en UVT no hace distinciones y aplica a todas las rentas exentas y deducciones que tenga la persona natural residente contribuyente del impuesto sobre la renta.

**1.26. DESCRIPTOR:** Depuración de la renta

**Rentas exentas y deducciones**

**Aportes voluntarios a Fondos de Pensión Voluntaria**

**¿Gozan del beneficio de renta exenta los retiros de aportes voluntarios, aunque no cumplan el período mínimo de permanencia de 10 años, si se cumplen los requisitos para acceder a la pensión de vejez o jubilación?**

Se ha interpretado por parte de este despacho que en el caso de una persona que se encuentra pensionada y recibe unos ingresos que destina como aportes voluntarios a un fondo de pensiones, en los términos del artículo 126-1 del E. T., que estos no conservan el carácter de renta exenta pues no cumplen con las condiciones de permanencia por un período mínimo de diez (10) años, ni son considerados para el cumplimiento de los requisitos para acceder a la pensión de vejez o jubilación. En consecuencia, se ha concluido que los retiros parciales o totales por concepto de estos aportes no se encuentran exentos y constituirán renta gravada en el año en que sean retirados.

Esta interpretación se basa en lo señalado en el artículo 126-1 del E. T., y el artículo 1.2.4.1.33. del Decreto 1625 de 2016, adicionado por el Decreto 2250 de 2017, normas que establecen que para no someterse a retención en la fuente y/o no se traten como renta gravable los aportes que se efectúen a un Fondo de Pensiones Voluntarios deben cumplir con el requisito de permanencia señalado en la ley, y en caso de no permanecer por este lapso de tiempo se puede retirar cuando se cumplan los requisitos señalados en la ley para acceder a la pensión de vejez o jubilación, muerte o incapacidad.

En ese sentido se precisa en la doctrina vigente que estas circunstancias deben estar certificadas de acuerdo con el régimen legal de la seguridad social y/o cuando se destinen a la adquisición de vivienda financiada o no por entidades sujetas a la inspección y vigilancia de la Superintendencia Financiera de Colombia, a través de créditos hipotecarios o leasing habitacional, siempre que se cumplan las condiciones que establezca la ley y el decreto reglamentario.

Sin perjuicio de la interpretación anteriormente expuesta, resulta oportuno precisar que los valores por concepto de estos aportes que se efectúen a un Fondo de Pensiones Voluntarios y se dispongan para complemento pensional, mantendrán el carácter de renta exenta, esto en concordancia con el propósito del artículo 126-1 del E. T., que permite su retiro para efectos pensionales.

En ese sentido es oportuno señalar que el artículo 173 del Estatuto Orgánico del Sistema Financiero establece en su numeral 1 que:  _“las prestaciones establecidas en un plan de pensiones de jubilación e invalidez podrán consistir en el pago de un capital o de una renta temporal o vitalicia por causa de vejez, invalidez, viudez u orfandad”._

Es oportuno precisar que estas prestaciones son independientes de las modalidades de pensión obligatoria. A modo de ejemplo se trae a colación lo relacionado con el Régimen de Ahorro Individual con Solidaridad (RAIS), que de acuerdo con los artículos 80, 81 y 82 de la Ley 100 de 1993 puede tener, entre otras, las siguientes modalidades: i) renta vitalicia inmediata; ii) retiro programado; y iii) retiro programado con renta vitalicia diferida.

En este punto es importante indicar que es posible que una persona ya pensionada en un régimen como el RAIS, realice aportes a Fondo de Pensión Voluntario y percibir prestaciones que pueden consistir en: (i) pago del capital; (ii) pago de una renta temporal o periódica; o (iii) posibilidad de tomar su capital para la contratación directa de una renta vitalicia.

En este caso, este despacho interpreta que la destinación de sumas aportadas a Fondo de Pensión Voluntario para los fines antes señalados, le permite mantener el tratamiento de la renta exenta y no estar sometidos a retención en la fuente, pues tienen como finalidad el complemento pensional, con lo que se cumple el propósito del artículo 126-1 del E. T.

**1.27. DESCRIPTOR:** Depuración de la renta

**Tratamiento tributario de los sistemas especiales de determinación de renta.**

**Aspectos generales.**

**¿Cómo es la depuración de la cédula de renta no laborales cuando hay lugar a (i) renta por comparación patrimonial, o (ii) declarar activos omitidos, pasivos inexistentes y recuperación de deducciones?**

Para iniciar, es preciso remitirnos al artículo 341 del E. T., el cual establece la depuración de la cédula de rentas no laborales en los siguientes términos:

_“Para efectos de establecer la renta líquida correspondiente a las rentas no laborales, del valor total de los ingresos de esta cédula se restarán los ingresos no constitutivos de renta, y los costos y gastos procedentes y debidamente soportados por el contribuyente._

_Podrán restarse todas las rentas exentas y deducciones imputables a esta cédula, siempre que no excedan el diez (10%) del resultado del inciso anterior, que en todo caso no puede exceder mil (1.000) UVT. (…)”._

Por su parte, el artículo 1.2.1.19.2. del Decreto 1625 de 2016 (contenido en el artículo 4° del Decreto 2250 de 2017) indica lo siguiente:

**_“Parágrafo._**_Para las personas naturales y sucesiones ilíquidas la renta líquida gravable por comparación patrimonial no justificada la_ _adicionará como renta líquida gravable por comparación patrimonial a la cédula de rentas no laborales_ _._

_La adición de la renta líquida gravable por comparación patrimonial no permite ningún tipo de renta exenta ni deducción_ “ (Subrayado fuera del texto original).

Asimismo, el artículo 1.2.1.21.4. del Decreto 1625 de 2016 (contenido en el artículo 7° del Decreto 2250 de 2017) indica lo siguiente:

**_“artículo 1.2.1.21.4. Tratamiento de los activos omitidos, pasivos inexistentes y recuperación de deducciones._**_Cuando el contribuyente tenga activos omitidos y/o pasivos inexistentes,__incluirá sus respectivos valores como renta líquida gravable, dentro de la cédula de rentas no laborales_ _, atendiendo a lo dispuesto en el_ artículo 239-1_ _del Estatuto Tributario._

_Cuando se trate de recuperación de deducciones, estas serán tratadas como renta líquida gravable dentro de la cédula de rentas no laborales_ _._

_Los tratamientos aquí previstos no permiten ningún tipo de renta exenta ni deducción_ “ (Subrayado fuera del texto original).

Como se advierte de las normas transcritas, tanto la renta por comparación patrimonial como los activos omitidos, pasivos inexistentes y recuperación de deducciones, deben incluirse  __directamente__ en la renta líquida gravable no laboral.

Es decir que los conceptos mencionados no pueden incluirse como un ingreso bruto no laboral o como una renta líquida; lo anterior, puesto que serían susceptibles de disminuirse con ingresos no constitutivos de renta y ganancia ocasional, costos y gastos, rentas exentas y deducciones que no están permitidos, de conformidad con las normas transcritas.

**1.28. DESCRIPTOR:** Depuración de la renta

**Tratamiento tributario de los sistemas especiales de determinación de renta.**

**Sistema de renta presuntiva.**

**¿Cuál es el procedimiento para la aplicación de las rentas exentas en la renta presuntiva para las personas naturales y el sistema cedular?**

Se ha definido la renta presuntiva como una renta líquida especial de carácter exceptivo y que tiene su aplicación por defecto, es decir, cuando la renta líquida ordinaria es inferior a lo que la ley ha considerado constituye el rendimiento mínimo que debe tener un patrimonio.

En ese sentido, la renta presuntiva constituye un mecanismo de liquidación del impuesto que obliga al contribuyente a tomar como base el patrimonio líquido del año inmediatamente anterior, que se presume generó como mínimo una renta presunta del 3.5% (artículo 188 del E. T.).

Tratándose de las personas naturales, el artículo 1° de la Ley 1819 de 2016, introdujo el Título V al Estatuto Tributario, concretamente, el Capítulo I que trata de la  _“determinación del impuesto sobre la renta de las personas naturales”_. Esta mención resulta oportuna para efectos del (i) sistema de renta presuntiva en personas naturales y (ii) procedimiento para la aplicación de las rentas exentas en la renta presuntiva.

**Sistema de renta presuntiva en personas naturales.**

Sobre el particular es relevante mencionar lo dispuesto en el artículo 333 del E. T., modificado por el artículo 1° de la Ley 1819 de 2016, titulado  _“base de renta presuntiva”_ :

**_“_**** artículo 333_**** _. Base de renta presuntiva._**_Para efectos de los artículos_ _188_ _y_ _189_ _de este Estatuto, la renta líquida determinada por el sistema ordinario será la_ _suma de todas las rentas líquidas cedulares_ _”._

Para efectos de la asignación de la renta presuntiva, y teniendo en cuenta el sistema cedular, el artículo 1.2.1.19.15. del Decreto 1625 de 2016 adicionado por el Decreto 2250 de 2017 indica:

**_“artículo 1.2.1.19.15. Procedimiento para la asignación de la renta presuntiva cedular._**_Las personas naturales residentes contribuyentes del impuesto sobre la renta, determinarán la renta presuntiva de conformidad con lo establecido en el artículo_ _188_ _y_ _189_ _del Estatuto Tributario._

_La renta presuntiva obtenida se comparara´ contra la sumatoria de todas las rentas líquidas cedulares. En caso que la renta presuntiva sea mayor, la adicionara´ como renta líquida gravable a la cédula de rentas no laborales_ _._

_Del procedimiento aplicado anteriormente, se generara´ un exceso de renta presuntiva, que corresponde a la diferencia de la renta líquida cedular y la renta líquida determinada por el sistema de renta presuntivo. El exceso generado se compensara´ de conformidad con lo establecido en el artículo siguiente._

_(…)”_(Subrayado fuera del texto original).

En este punto es importante precisar que este despacho interpreta que el término “adición” en la norma anteriormente transcrita debe entenderse como la imputación del resultado del cálculo de la renta presuntiva en la renta líquida de la cédula de rentas no laborales. En ningún caso, esa imputación puede entenderse cómo una sumatoria de ambas rentas líquidas (la determinada por sistema ordinario cedular y la determinada por renta presuntiva) pues solo una de dichas rentas líquidas -la mayor entre ambas- puede ser entendida como renta gravable.

Así las cosas, la persona natural deberá depurar sus rentas por el sistema ordinario cedular con el fin de obtener la renta líquida cedular (por cada una de las cédulas en las que obtuvo ingreso) para así proceder a la sumatoria de que tratan los artículos 333 del E. T., y artículo 1.2.1.19.15. del Decreto 1625 de 2016.

De manera paralela, la persona natural deberá tener en cuenta su patrimonio líquido del año inmediatamente anterior, que sirve de base para efectuar el cálculo de la renta presuntiva, y podrá restar los valores establecidos en el artículo 189 del E. T., para así obtener la base presuntiva a la que se le aplicará la tarifa del 3.5%; posteriormente, restará las rentas exentas de manera proporcional (como se explicará más adelante).

Lo anterior, es importante con el fin de establecer las bases que son susceptibles de ser comparables, toda vez que tanto la base resultante del sistema ordinario cedular como la base presuntiva deben soportar el mismo proceso de depuración. De no ser así, las bases obtenidas no serían comparables toda vez que aquella resultante del sistema ordinario cedular estaría afectada por la resta de las rentas exentas; mientras que la base presuntiva no habría tenido en cuenta este concepto.

Esta particularidad respecto de las rentas exentas, encuentra su razón de ser en las modificaciones que introdujo la Ley 1819 de 2016, en el sistema de renta cedular, en el cual las rentas exentas se restan antes de la obtención de la renta líquida cedular; por el contrario, antes de la Ley 1819 de 2016, las rentas exentas se restaban, indistintamente, de aquella base que resultara superior entre la renta líquida ordinaria o la renta presuntiva.

Es decir, que con el nuevo sistema cedular, las rentas exentas se restan en un momento distinto al que se venían restando anteriormente; situación que no ocurre con las deducciones cuyo tratamiento y forma de depuración no se vio modificado por la Ley 1819 de 2016, de ahí que dicho concepto no tenga ninguna consideración especial.

Así las cosas, es necesario aplicar un criterio de simetría con el fin de realizar la comparación entre bases comparables, razón por la cual las rentas exentas se restarán en la depuración para llegar a la renta líquida presuntiva, de la misma manera que se hace para llegar a la renta líquida cedular.

__(ii) Procedimiento para la aplicación de las rentas exentas en la renta presuntiva__

Ahora bien, con ocasión de lo explicado anteriormente, para llegar a las bases comparables -tanto por el sistema ordinario cedular como por el sistema presuntivo- es necesario aplicar las rentas exentas tal como se explicará a continuación.

·  __Sistema ordinario cedular__

Para llegar a la renta líquida cedular de cada una de las cédulas en las que se obtuvieron ingresos, el contribuyente deberá determinar las rentas exentas que resultan procedentes para cada una de dichas cédulas. Lo anterior, en función de las limitaciones fijadas en el E. T., a saber:

\- 40% o 5.040 UVT para la renta líquida cedular de las rentas de trabajo (artículo 336 del E. T.).

\- 10% o 1.000 UVT para la renta líquida cedular de las rentas de capital y no laborales (artículos 339 y 341 del E. T.).

\- En relación con la renta líquida cedular de las rentas de pensiones se tendrá en cuenta lo dispuesto en el numeral 5 del artículo 206 del E. T.

Habiendo precisado lo anterior, para un mejor entendimiento se presenta el siguiente caso que busca ilustrar la dinámica de aplicación de las rentas exentas.

**Paso número 1.** A efectos del ejemplo, se determina que el contribuyente recibe rentas de trabajo y que tiene rentas exentas atribuibles a dicha cédula.

**Paso número 1** |  Ingresos laborales |  $80.000.000  
---|---|---  
INCRNGO |  $4.800.000  
Subtotal |  $75.200.000  
  
**Paso número 2.** Determinar las rentas exentas y deducciones que tiene el contribuyente, así como su porcentaje de participación respecto del monto total de rentas exentas (R. E.) y deducciones (D.),  _sin limitación_ , que a efectos del ejemplo corresponden a $36.050.000.

|  |  **Monto** |  **% de participación**  
---|---|---|---  
**Paso número 2** |  R. E. Aporte AFC |  $15.000.000 |  42%  
R. E. Numeral 10 art. 206 E. T. |  $13.050.000 |  36%  
D. Dependientes |  $ 8.000.000 |  22%  
Monto total de R. E. + D. |  $36.050.000 |  100%  
  
Es importante anotar que la determinación del porcentaje de participación en el sistema cedular servirá de insumo para calcular el límite de rentas exentas que pueden ser restadas del caculo de renta presuntiva. Lo anterior siempre y cuando la sumatoria de rentas exentas y deducciones superen el límite fijado por la ley, esto es, 40% o 10% en función de la cédula que se esté depurando.

Ahora bien, cuando la sumatoria de rentas exentas y deducciones no superen el límite fijado por la ley ya no habrá lugar a calcular el porcentaje de participación, toda vez que el valor correspondiente a rentas exentas (sin tomar las deducciones) es el que se restará en el cálculo de renta presuntiva.

**Paso número 3.** Determinar el monto máximo que podrá tomar a título de renta exenta y deducciones.

**Paso número 3** |  Monto limitado al 40% |  $30.080.000  
---|---|---  
  
