doc_id,title,text
_“**ARTÍCULO 235-2. RENTAS EXENTAS A PARTIR DEL AÑO GRAVABLE 2019.** Sin perjuicio de las rentas exentas de las personas naturales de los artículos 126-1, 126-4, 206 y 206-1 del Estatuto Tributario y de las reconocidas en los convenios internacionales ratificados por Colombia, las únicas excepciones legales de que trata el artículo 26 del Estatuto Tributario son las siguientes: (…)_

_5.**Aprovechamiento de nuevas plantaciones forestales,** incluida la guadua, el caucho y el marañón, según la calificación que para el efecto expida la corporación autónoma regional o la entidad competente._

_En las mismas condiciones, gozarán de la exención los contribuyentes que a partir de la fecha de entrada en vigencia de la Ley 1943 de 2018 realicen inversiones en nuevos aserríos y plantas de procesamiento vinculados directamente al aprovechamiento a que se refiere este numeral._

_También gozarán de la exención de que trata este numeral, los contribuyentes que, a la fecha de entrada en vigencia de la Ley 1943 de 2018, posean plantaciones de árboles maderables y árboles en producción de frutos, debidamente registrados ante la autoridad competente. La exención queda sujeta a la renovación técnica de los cultivos._

_La exención de que trata el presente numeral estará vigente hasta el año gravable 2036, incluido”_ (Negritas fuera de texto).

Por su parte, el artículo 8 de la Ley 139 de 1994, norma que creó el Certificado de Incentivo Forestal (CIF), dispuso como efectos de la obtención del mismo:

_“**ARTÍCULO 8. EFECTOS DEL OTORGAMIENTO DE CERTIFICADOS.** El otorgamiento de Certificados de Incentivo Forestal produce para los beneficiarios los siguientes efectos:_

**_a) No tendrán derecho a los incentivos o exenciones tributarios que por la actividad forestal prevea la ley._**

_b) Solo podrán solicitar nuevamente el Certificado de Incentivo Forestal para realizar plantaciones en el mismo suelo, transcurridos 20 años después del otorgamiento de dicho Certificado; salvo que, por fuerza mayor o caso fortuito, debidamente comprobado por la entidad competente para la administración y manejo de los recursos naturales renovables y del medio ambiente, se haya perdido la plantación que fue objeto de Certificado._

_c) Por constituir un reconocimiento por parte del Estado de los beneficios ambientales que origina la reforestación, los ingresos por Certificados de Incentivo Forestal no constituyen renta gravable”_(Negritas fuera de texto).

En segundo término, se deduce de las normas citadas que la renta exenta del numeral 5 del artículo 235-2 del Estatuto Tributario, en efecto se trata de una exención tributaria por el aprovechamiento de nuevas plantaciones forestales. Por lo cual, se encuentra limitada su aplicación para los beneficiarios de los Certificados de Incentivo Forestal (CIF), ya que el artículo 8 de la Ley 139 de 1994 lo dispuso así expresamente.

En este orden de ideas, téngase en cuenta que la función de interpretación normativa está sujeta a los criterios de interpretación consagrados en el Código Civil y en este sentido, el artículo 27 ibídem, dispone que  _“cuando el sentido de la ley sea claro, no se desatenderá su tenor literal a pretexto de consultar su espíritu”._

Por consiguiente, por expresa disposición legal los beneficiarios de los Certificados de Incentivo Forestal (CIF) no tienen derecho a los incentivos o exenciones tributarios que por la actividad forestal prevea la ley."

"Dirección de Impuestos y Aduanas Nacionales, Oficio nro. 48131 de 01-09-2013","Dirección de Impuestos y Aduanas Nacionales, Oficio nro. 48131 de 01-09-2013","|  **OFICIO N° 048131** **02-08-2013** **DIAN** Dirección de Gestión Jurídica Bogotá, D.C. 100202208 – 1121 Doctora **PAULA ACOSTA** Subdirectora Territorial y de Inversión Pública Departamento Nacional de Planeación – DNP Calle 26 No. 13 – 19 Bogotá, D.C. **Ref:** Solicitud radicado número 54001 del 09/07/2013 Cordial saludo Dra Paula. De conformidad con el artículo 19 del Decreto 4048 de 2008 y la Orden Administrativa 000006 de 2009, este despacho está facultado para absolver las consultas escritas que se formulen sobre la interpretación y aplicación de las normas tributarias, aduaneras o de comercio exterior y control cambiario en lo de competencia de la Dirección de Impuestos y Aduanas Nacionales. En el oficio de la referencia, solicita dar alcance a nuestro Oficio No. 038348 del 24 de junio de 2013, que se ocupó de las obligaciones tributarias a que está sometida una sociedad extranjera que presta servicios de consultoría a un gobierno extranjero, y teniendo en cuenta que algunos de los resultados del servicio serán compartidos al Gobierno Colombiano. Se solicita complementación sobre las obligaciones con respecto al impuesto sobre las ventas a que está sometida dicha sociedad, bajo el supuesto de que parte del servicio será prestado en el territorio nacional por cuatro consultores, vinculados mediante contrato de trabajo con la firma extranjera bajo el régimen del Estado de residencia de dicha sociedad, y otra parte del servicio será prestado desde el exterior. Al respecto, este Despacho hace las siguientes consideraciones: El artículo 420 del Estatuto Tributario regula la prestación de servicios consultoría, asesoría y auditoría, prestados en el territorio nacional y desde el exterior, en los siguientes términos: **_“artículo 420. Hechos sobre los que recae el impuesto._**_El impuesto a las ventas se aplicará sobre:_ _(…)_ _b. La prestación de servicios en el territorio nacional._ _(…)_ _Parágrafo 3. Para la prestación de servicios en el territorio nacional se aplicarán las siguientes reglas:_ _(…)_ _3\. Los siguientes servicios ejecutados desde el exterior a favor de usuarios o destinatarios ubicados en el territorio nacional, se entienden prestados en Colombia, y por consiguiente causan el impuesto sobre las ventas según las reglas generales:_ _(…)_ _b) Los servicios profesionales de consultoría, asesoría y auditoría;_ _(…)”_ De acuerdo con el texto transcrito, se causa el impuesto sobre las ventas por la prestación de servicios de consultoría en el territorio nacional y por aquellos que se presten desde el exterior a usuarios o destinatarios ubicados en el territorio nacional. Por lo tanto, en el caso bajo estudio, se causa el impuesto sobre las ventas por el servicio prestado por la sucursal o establecimiento permanente en Colombia. Por el contrario, el servicio prestado desde el exterior por la sociedad extranjera al gobierno extranjero, no causa el impuesto sobre las ventas. En cuanto a la responsabilidad por el pago del impuesto, el artículo 437 del Estatuto Tributario establece: **_“artículo 437. Los comerciantes y quienes realicen actos similares a los de ellos y los importadores son sujetos pasivos._**_Son responsables del impuesto:_ _(…)_ _c. Quienes presten servicios…”_ En el caso en que la prestación del servicio se realiza por una sucursal o establecimiento permanente de una sociedad extranjera en Colombia y en el supuesto de que se trate de servicios o realización de operaciones gravadas con este impuesto, es pertinente citar apartes del Concepto Unificado del Impuesto sobre las Ventas 00001 de 2003: _“Las sucursales de sociedades extranjeras son responsables del impuesto sobre las ventas cuando tengan la calidad de comerciantes e intervengan en cualquiera de los actos de producción o distribución de bienes gravados, cuando presten servicios gravados en el territorio nacional, o cuando importen bienes gravados. Incluso las entidades extranjeras con oficina en Colombia, así sean sin ánimo de lucro, pueden ser responsables del impuesto sobre las ventas.”_ De acuerdo con lo anterior, en el caso en estudio, el establecimiento permanente o sucursal extranjera está en la obligación de declarar y pagar el impuesto sobre las ventas causado por la prestación del servicio en el territorio nacional. Bajo este supuesto, al ser el establecimiento permanente o sucursal de sociedad extranjera, a la que se refiere la consulta, responsable del impuesto sobre las ventas, tendrá derecho a descontar el impuesto sobre las ventas pagado en Colombia por los costos y gastos en que incurrió en el desarrollo de su actividad. Una situación diferente se presenta, cuando el prestador del servicio no tiene domicilio en el país, evento en el cual, conforme con el artículo 437-2 del Estatuto Tributario, el cumplimiento de la obligación de pago del impuesto sobre las ventas se realiza mediante el mecanismo de la retención en la fuente, en el momento en que se remunera el respectivo servicio: **_“artículo 437-2. Agentes de retención en el impuesto sobre las ventas._**_Actuarán como agentes retenedores del impuesto sobre las ventas en la adquisición de bienes y servicio gravados:_ _(…)_ _3) Quienes contraten con personas o entidades sin residencia o domicilio en el país la prestación de servicios gravados en el territorio Nacional, con relación a los mismos…”_ Ahora bien, si el prestador del servicio no tiene domicilio en el país y el servicio es remunerado directamente por un Gobierno extranjero, no obligado al cumplimiento de obligaciones en el territorio colombiano, no hay lugar a practicar retención en la fuente por ausencia de agente retenedor autorizado. De otra parte, con el fin de complementar el Oficio 038348 del 24 de junio de 2013 con respecto al impuesto sobre la renta causado por los servicios considerados de fuente nacional y las rentas que son atribuibles a un establecimiento permanente, se efectúan las siguientes precisiones: El artículo 20-2 regula la tributación de los establecimientos permanentes y sucursales en los siguientes términos: **_“artículo 20-2. Tributación de los establecimientos permanentes y sucursales._**_Las personas naturales no residentes y las personas jurídicas y entidades extranjeras que tengan un establecimiento permanente o una sucursal en el país, según el caso, serán contribuyentes del impuesto sobre la renta y complementarios con respecto a las rentas y ganancias ocasionales de fuente nacional que le sean atribuibles al establecimiento permanente o a la sucursal, según el caso, de acuerdo con lo consagrado en este artículo y con las disposiciones que lo reglamenten. La determinación de dichas rentas y ganancias ocasionales se realizará con base en criterios de funciones, activos, riesgos y personal involucrados en la obtención de las mencionadas rentas y ganancias ocasionales._ **_Parágrafo._**_Para propósitos de la atribución de las rentas y ganancias ocasionales a que se refiere este artículo, los establecimientos permanentes y las sucursales de sociedades extranjeras deberán llevar contabilidad separada en la que se discriminen claramente los ingresos, costos y gastos que les sean atribuibles. Sin perjuicio del cumplimiento por parte de los obligados al régimen de precios de transferencia de los deberes formales relativos a la declaración informativa y a la documentación comprobatoria, para efectos de lo establecido en este artículo, la contabilidad de los establecimientos permanentes y de las sucursales de sociedades extranjeras deberá estar soportada en un estudio sobre las funciones, activos, riesgos y personal involucrados en la obtención de las rentas y de las ganancias ocasionales atribuidas a ellos.”_ Conforme con este artículo, los establecimientos permanentes y sucursales son contribuyentes del impuesto sobre la renta y complementarios “… con respecto a las rentas y ganancias ocasionales de fuente nacional que le sean atribuibles al establecimiento permanente o sucursal…”. Dicha atribución de rentas al establecimiento permanente, conforme con el texto transcrito, debe estar fundamentada en las funciones, activos, riesgos y personal involucrados en la actividad desarrollada por el establecimiento permanente en Colombia. En consecuencia, deberán considerarse los hechos y demás circunstancias del caso particular que sean relevantes para efectuar una debida atribución de rentas que serán gravadas en cabeza del establecimiento permanente en Colombia y aquellas que corresponda atribuir a la sociedad en el exterior. Con respecto a aquellas rentas de fuente nacional no atribuidas al establecimiento permanente en Colombia, deberá darse aplicación al artículo 408 del Estatuto Tributario que indica: **_“artículo 408. Tarifas para rentas de capital y de trabajo._**_En los casos de pagos o abonos en cuenta por concepto de intereses, comisiones, honorarios, regalías, arrendamientos, compensaciones por servicios personales, o explotación de toda especie de propiedad industrial o del “know-how”, prestación de servicios técnicos o de asistencia técnica, beneficios o regalías provenientes de la propiedad literaria, artística y científica, la tarifa de retención será del treinta y cinco por ciento (35%) del valor nominal del pago o abono._ _Los pagos o abonos en cuenta por concepto de consultorías, servicios técnicos y de asistencia técnica, prestados por personas no residentes o no domiciliadas en Colombia, están sujetos a retención en la fuente a la tarifa única del 10%, a título de impuestos de renta, bien sea que se presten en el país o desde el exterior…”_ En consecuencia, los ingresos de fuente nacional colombiana por la prestación del servicio de consultoría que sean atribuidos directamente a la parte de la empresa desarrollada por la sociedad en el exterior, están sometidos a retención en la fuente a la tarifa del diez por ciento (10%) sobre el respectivo pago o abono en cuenta,  _a cargo del respectivo agente retenedor, cuando a ello hubiere lugar_. En el caso en que esta retención no sea practicada y siempre y cuando se trate de ingresos de fuente nacional, la sociedad extranjera deberá presentar declaración del impuesto sobre la renta y complementarios por las rentas de fuente nacional que le son atribuidas a la parte de su empresa en el exterior. Para terminar, no deberán declararse ni están sometidos a retención en la fuente los ingresos atribuidos directamente a la sociedad en el exterior por el servicio no prestado en el territorio nacional y suministrado al exterior al gobierno extranjero, ya que no constituyen ingresos de fuente nacional. En los anteriores términos se resuelve su consulta y cordialmente le informamos que tanto la normatividad en materia tributaria, aduanera y cambiaria, como los conceptos emitidos por la Dirección de Gestión Jurídica en estas materias pueden consultarse directamente en nuestra base de datos jurídica ingresando a la página electrónica de la DIAN:[http://www.dian.gov.co](http://www.dian.gov.co/) siguiendo los iconos: “Normatividad”-“Técnica” y seleccionando los vínculos “doctrina” y “Dirección de Gestión Jurídica”."

"Dirección de Impuestos y Aduanas Nacionales, Oficio nro. 56875 de 01-09-2013","Dirección de Impuestos y Aduanas Nacionales, Oficio nro. 56875 de 01-09-2013","Atento saludo Señora Maria Fernanda.
De conformidad con el artículo 19 del Decreto 4048 de 2008 y la Orden Administrativa 0006 de 2009, es función de este Despacho absolver las consultas escritas que se formulen sobre la interpretación y aplicación de las normas tributarias de carácter nacional, aduaneras y cambiarias en lo de competencia de esta entidad, ámbito dentro del cual se atenderán sus inquietudes.
Se consulta si el impuesto sobre la renta para la Equidad CREE, queda comprendido por el artículo 2° del Convenio entre la República de Chile y la República de Colombia para evitar la doble imposición.
El Convenio entre la República de Chile y la República de Colombia para evitar la doble imposición y para prevenir la evasión fiscal en relación al impuesto a la renta y al patrimonio, aprobado por la Ley 1261 de 2008, señaló en su artículo 2° los impuestos a los cuales se aplica:
_“ARTÍCULO 2°. IMPUESTOS COMPRENDIDOS._
_1\. Este Convenio se aplica a los impuestos sobre la renta y sobre el patrimonio exigibles por cada uno de los Estados Contratantes, cualquiera que sea el sistema de exacción._
_2\. Se consideran impuestos sobre la renta y sobre el patrimonio los que gravan la totalidad de la renta o del patrimonio o cualquier parte de los mismos, incluidos los impuestos sobre las ganancias derivadas de la enajenación de bienes muebles o inmuebles, los impuestos sobre el importe de sueldos o salarios pagados por las empresas, así como los impuestos sobre las plusvalías._
_3\. Los impuestos actuales a los que se aplica este Convenio son, en particular:_
_a) En chile, los impuestos establecidos en la “Ley sobre Impuesto a la Renta” (en adelante denominados “Impuesto chileno”), y_

_b) En Colombia:_

_i) El impuesto sobre la Renta y Complementarios;_

_ii) El Impuesto de orden nacional sobre el Patrimonio (en adelante denominados “Impuesto colombiano”)._

_4\. El Convenio se aplicará igualmente a los impuestos de naturaleza idéntica o sustancialmente análoga e impuestos que se establezcan con posterioridad a la fecha de la firma del mismo, y que se añadan a los actuales o les sustituyan. Las autoridades competentes de los Estados Contratantes se comunicarán mutuamente, al final de cada año, las modificaciones sustanciales que se hayan introducido en sus respectivas legislaciones impositivas”._

Debe resaltarse que la norma transcrita, en su párrafo 4°, indica que el Convenio “… aplicará igualmente a los impuestos de naturaleza idéntica o sustancialmente análoga e impuestos que se establezcan con posterioridad a la fecha de la firma del mismo…”.

Ahora bien, la Ley 1607 de 2012 creó, a partir del 1° de enero de 2013, un nuevo tributo del orden nacional con el propósito de aportar para beneficio de los trabajadores, la generación de empleo y la inversión social, los recursos presupuestales requeridos, denominado Impuesto sobre la Renta para la Equidad (CREE).

Es pertinente entonces analizar los elementos de la obligación tributaria del Impuesto sobre la Renta para la Equidad y del Impuesto sobre la Renta, específicamente el hecho generador del tributo y su base gravable, por ser éstos los elementos que contienen las características esenciales de un impuesto de renta.

El hecho generador de la obligación tributaria, en el Impuesto sobre la Renta para la Equidad, conforme con el artículo 21 de la Ley 1607 de 2012, lo constituye la obtención de ingresos que sean susceptibles de incrementar el patrimonio de los sujetos pasivos en el año o período gravable.

A su turno, en el Impuesto sobre la Renta el hecho generador lo constituye todo ingreso ordinario o extraordinario susceptible de producir un incremento neto del patrimonio en el momento de su percepción.

En armonía con el anterior elemento, la base gravable del Impuesto sobre la Renta se caracteriza por contener minoraciones estructurales – ingresos no constitutivos, costos, deducciones, etc. – que se restan de la suma de todos los ingresos obtenidos por el sujeto pasivo del impuesto.

En el caso del Impuesto sobre la Renta para la Equidad, conforme con el artículo 22 de la Ley 1607 de 2012, se adoptó un gran porcentaje de las minoraciones estructurales contenidas en el Impuesto sobre la Renta. En este sentido, si bien las minoraciones estructurales no son idénticas en ambos impuestos, la determinación de su base gravable permite la depuración de ingresos, de tal manera que es pertinente concluir que la naturaleza de ambos tributos es sustancialmente análoga.

Por las razones expuestas, el Convenio entre la República de Chile y la República de Colombia para evitar la doble imposición y para prevenir la evasión fiscal en relación al Impuesto a la Renta y al Patrimonio se aplica al Impuesto sobre la Renta para la Equidad CREE."

"Dirección de Impuestos y Aduanas Nacionales, Oficio nro. 576 de 01-05-2020","Dirección de Impuestos y Aduanas Nacionales, Oficio nro. 576 de 01-05-2020","100208221 - 576
Bogotá, D.C.
artículos 1.2.1.22.19 y 1.2.1.22.20 del Decreto 1625 de 2016.
De conformidad con el artículo 20 del Decreto 4048 de 2008, este Despacho está facultado para absolver las consultas escritas que se formulen sobre la interpretación y aplicación de las normas tributarias, aduaneras y cambiarias, en el marco de las competencias de la Dirección de Impuestos y Aduanas Nacionales. Por consiguiente, no corresponde a este Despacho, en ejercicio de las funciones descritas anteriormente, prestar asesoría específica para atender casos particulares, ni juzgar o calificar las decisiones tomadas por otras dependencias o entidades.
Mediante el radicado de la referencia, el peticionario indica que un contribuyente tiene como única actividad la silvicultura, (Actividad 0210) con establecimiento de cultivo de eucalipto y pino, registrado ante la autoridad competente y certificado como proveedor de bonos de carbono. Posteriormente, cita el numeral 5 del artículo 235-2 del Estatuto Tributario, modificado por las leyes 1943 de 2018 y 2010 de 2019, con el fin de establecer si de acuerdo con dicha disposición normativa, los ingresos por la venta de bonos de carbono pueden considerarse como exentos.
En caso de considerase gravados con el impuesto sobre la renta, el peticionario pregunta si se pueden asociar costos y gastos administrativos (salarios) y operativos (insumos y salarios) necesarios para hacer crecer dichos árboles y así haber sido certificados para la venta de bonos de carbono?

Sobre el particular, este Despacho considera lo siguiente:

**I. Numeral 5 del artículo 235-2 del Estatuto Tributario**

En primer lugar, es pertinente mencionar que el artículo 79 de la Ley 1943 de 2018 modificó el artículo 235-2 del Estatuto Tributario, incluyendo aquellas disposiciones en relación con la renta exenta por aprovechamiento de nuevas plantaciones forestales.

Sin embargo, la Corte Constitucional declaró la inexequibilidad de la Ley 1943 de 2018 mediante la Sentencia C-481 de 2019, en donde se dispuso que dicho fallo tenía un efecto diferido y no afectaba las situaciones jurídicas consolidadas.

Posteriormente, el artículo 91 de la Ley 2010 de 2019 modificó de la siguiente forma el numeral 5 del artículo 235-2 del Estatuto Tributario:

_“Sin perjuicio de las rentas exentas de las personas naturales de los artículos 126-1, 126-4, 206 y 206-1 del Estatuto Tributario y de las reconocidas en los convenios internacionales ratificados por Colombia, las únicas excepciones legales de que trata el artículo 26 del Estatuto Tributario son las siguientes:_

_(...)_

_5\. Aprovechamiento de nuevas plantaciones forestales, incluida la guadua, el caucho y el marañón según la calificación que para el efecto expida la corporación autónoma regional o la entidad competente._

_En las mismas condiciones, gozarán de la exención los contribuyentes que**a partir de la fecha de entrada en vigencia de la Ley 1943 de 2018** realicen inversiones en nuevos aserríos y plantas de procesamiento vinculados directamente al aprovechamiento a que se refiere este numeral._

_También gozarán de la exención de que trata este numeral, los contribuyentes que**, a la fecha de entrada en vigencia de la Ley 1943 de 2018** , posean plantaciones de árboles maderables y árboles en producción de frutos, debidamente registrados ante la autoridad competente. La exención queda sujeta a la renovación técnica de los cultivos._

_La exención de que trata el presente numeral estará vigente hasta el año gravable 2036, incluido.”_

Al respecto, debe resaltarse que el Gobierno nacional reglamentará la renta exenta por aprovechamiento de nuevas plantaciones forestales de que trata el artículo 91 de la ley 2010 de 2019, por lo que se deberá atender a las disposiciones consagradas en dicho reglamento.

De igual manera, nótese que la anterior exención es aplicable a aquellos contribuyentes que, a la fecha de entrada en vigencia de la Ley 1943 de 2018, posean plantaciones de árboles maderables y árboles en producción de frutos, debidamente registrados ante la autoridad competente. Por lo tanto, la reglamentación que expida el Gobierno nacional será aplicable a aquellos contribuyentes que planean acceder a dicha renta exenta a partir de la vigencia de la Ley 1943 de 2018.

Sin embargo, es pertinente resaltar que, en virtud del principio de legalidad, consagrado en el artículo 338 de la Constitución Política, en materia de impuestos, las exenciones y/o exclusiones son de interpretación restrictiva y se concretan a las expresamente señaladas por la Ley. En consecuencia, no es factible, en aras de una interpretación analógica o extensiva de las normas, derivar beneficios o tratamientos preferenciales no previstos en ella.

Sin perjuicio de las disposiciones que establezca el reglamento, este Despacho se ha pronunciado sobre la enajenación de los bonos de carbono mediante Oficio 013505 de mayo de 2017, el cual anexamos para su conocimiento y en donde se concluyó que la enajenación de los mismos se encuentra gravada con el impuesto sobre la renta.

**II. Presupuestos para la procedencia de costos y gastos**

Respecto a la depuración de la renta líquida, el artículo 26 del Estatuto Tributario esteblece (sic) que se tiene en consideración los costos y gastos en que se incurren. Ahora bien, corresponde en cada caso determinar cuáles son (i) los costos realizados imputables a los ingresos y (ii) las expensas deducibles, que son aquellas que tengan relación de causalidad con las actividades productoras de renta y que sean necesarias y proporcionales de acuerdo con cada actividad.

Es pertinente resaltar que el artículo 176 del Estatuto Tributario dispone que:

